{"$schema":"https://json-schema.org/draft/2020-12/schema","additionalProperties":false,"properties":{"air_density_kg_m3":{"const":1.2},"convergence":{"additionalProperties":false,"properties":{"drag_range_relative":{"const":0.02},"flux_relative":{"const":0.001},"max_iterations":{"const":2000},"mean_drag_relative":{"const":0.01},"min_iterations":{"const":300},"other_residual":{"const":1e-05},"pressure_residual":{"const":0.0001},"window":{"const":100}},"required":["min_iterations","max_iterations","window","pressure_residual","other_residual","mean_drag_relative","drag_range_relative","flux_relative"],"type":"object"},"diagnostic_refinement":{"additionalProperties":false,"properties":{"box_max_m":{"items":{"type":"number"},"maxItems":3,"minItems":3,"type":"array"},"box_min_m":{"items":{"type":"number"},"maxItems":3,"minItems":3,"type":"array"},"level":{"enum":[6,7]},"reason_id":{"const":"oguri_coat_tip_flow_reversal_001"},"source_snapshot_sha256":{"pattern":"^[a-f0-9]{64}$","type":"string"}},"required":["reason_id","source_snapshot_sha256","box_min_m","box_max_m","level"],"type":"object"},"domain":{"additionalProperties":false,"properties":{"downstream_H":{"const":15},"lateral_H":{"const":5},"upstream_H":{"const":5},"vertical_H":{"const":5}},"required":["upstream_H","downstream_H","lateral_H","vertical_H"],"type":"object"},"frame":{"const":0},"geometry":{"additionalProperties":false,"properties":{"fidelity_gate":{"const":"DEFERRED_BY_USER_FOR_PROVISIONAL_MEASUREMENT"},"local_weld_m":{"const":1e-06},"min_triangle_area_m2":{"const":1e-16},"mode":{"const":"saved_0.9mm_local_repair"},"voxel_remesh_passes":{"const":0}},"required":["mode","local_weld_m","min_triangle_area_m2","voxel_remesh_passes","fidelity_gate"],"type":"object"},"ground_condition":{"const":"none"},"inlet_direction":{"const":[-1,0,0]},"kinematic_viscosity_m2_s":{"const":1.5e-05},"limits":{"additionalProperties":false,"properties":{"geometry_s":{"const":600},"memory_bytes":{"const":12884901888},"mesh_s":{"const":1200},"output_bytes":{"const":10737418240},"processes":{"const":4},"report_s":{"const":300},"solver_s":{"const":1500},"total_s":{"const":3600}},"required":["geometry_s","mesh_s","solver_s","report_s","total_s","processes","memory_bytes","output_bytes"],"type":"object"},"mesh":{"additionalProperties":false,"properties":{"background_H":{"const":0.25},"first_layer_fraction":{"const":0.2},"layer_expansion":{"const":1.2},"layers":{"const":3},"max_cells":{"const":1000000},"surface_level":{"const":5},"wake_level":{"const":2}},"required":["background_H","surface_level","wake_level","layers","first_layer_fraction","layer_expansion","max_cells"],"type":"object"},"package_version":{"const":"20260724"},"protocol_id":{"const":"RF-CFD-P1-PROVISIONAL-001"},"reference_height_m":{"const":1.67},"schema_version":{"const":"phase1-provisional-1"},"solver":{"const":"OpenFOAM Foundation 14/incompressibleFluid"},"speed_m_s":{"const":20},"turbulence_intensity":{"const":0.01},"turbulence_length_height_ratio":{"const":0.01},"turbulence_model":{"const":"kOmegaSST"}},"required":["schema_version","protocol_id","solver","package_version","frame","reference_height_m","inlet_direction","speed_m_s","air_density_kg_m3","kinematic_viscosity_m2_s","turbulence_model","turbulence_intensity","turbulence_length_height_ratio","ground_condition","geometry","domain","mesh","limits","convergence"],"type":"object"}
