{"air_density_kg_m3":1.2,"convergence":{"drag_range_relative":0.02,"flux_relative":0.001,"max_iterations":2000,"mean_drag_relative":0.01,"min_iterations":300,"other_residual":1e-05,"pressure_residual":0.0001,"window":100},"domain":{"downstream_H":15,"lateral_H":5,"upstream_H":5,"vertical_H":5},"frame":0,"geometry":{"fidelity_gate":"DEFERRED_BY_USER_FOR_PROVISIONAL_MEASUREMENT","local_weld_m":1e-06,"min_triangle_area_m2":1e-16,"mode":"saved_0.9mm_local_repair","voxel_remesh_passes":0},"ground_condition":"none","inlet_direction":[-1,0,0],"kinematic_viscosity_m2_s":1.5e-05,"limits":{"geometry_s":600,"memory_bytes":12884901888,"mesh_s":1200,"output_bytes":10737418240,"processes":4,"report_s":300,"solver_s":1500,"total_s":3600},"mesh":{"background_H":0.25,"first_layer_fraction":0.2,"layer_expansion":1.2,"layers":3,"max_cells":1000000,"surface_level":5,"wake_level":2},"package_version":"20260724","protocol_id":"RF-CFD-P1-PROVISIONAL-001","reference_height_m":1.67,"schema_version":"phase1-provisional-1","solver":"OpenFOAM Foundation 14/incompressibleFluid","speed_m_s":20,"turbulence_intensity":0.01,"turbulence_length_height_ratio":0.01,"turbulence_model":"kOmegaSST"}
